url,headline,img_path
/en/news-in-english/19/2195979/lithuanian-government-to-turn-to-constitutional-court-to-invalidate-anti-lgbtq-law,Lithuanian government to turn to Constitutional Court to invalidate anti-LGBTQ law,/img/2020/07/11/683541-692888-150x84.jpg
/en/news-in-english/19/2195683/first-michelin-star-will-cost-lithuania-eur1-7m,First Michelin star will cost Lithuania €1.7m,/img/2023/08/04/1563793-494806-150x84.jpg
/en/news-in-english/19/2195665/mp-expense-reports-give-appearance-of-abuse-by-lithuanian-top-politicians,MP expense reports give ‘appearance’ of abuse by Lithuanian top politicians,/img/2023/12/12/1659670-60182-150x84.jpg
/en/news-in-english/19/2195646/lithuanian-mp-zemaitaitis-stripped-of-immunity-over-anti-semitic-posts,Lithuanian MP Žemaitaitis stripped of immunity over anti-Semitic posts,/img/2023/12/05/1654516-626387-150x84.jpg
/en/news-in-english/19/2195576/lithuania-protests-russia-putting-politicians-on-wanted-list,Lithuania protests Russia putting politicians on wanted list,/img/2022/06/20/1288233-86908-150x84.jpg
/en/news-in-english/19/2195443/lithuanian-seniors-to-try-out-speed-dating-on-valentine-s-day,Lithuanian seniors to try out speed dating on Valentine’s Day,/img/2021/05/13/967924-938185-150x84.jpg
/en/news-in-english/19/2195052/does-vilnius-need-a-national-stadium,Does Vilnius need a national stadium?,/img/2022/08/29/1331261-944016-150x84.jpg
/en/news-in-english/19/2194573/more-lithuanian-towns-want-to-be-serviced-by-vilnius-riga-train,More Lithuanian towns want to be serviced by Vilnius–Riga train,/img/2024/01/08/1675583-642454-150x84.jpg
/en/news-in-english/19/2195029/belarusian-opposition-vows-to-correct-lithuania-border-error-in-new-passports,Belarusian opposition vows to correct Lithuania border error in new passports,/img/2022/08/10/1319972-889118-150x84.jpg
/en/news-in-english/19/2194938/kaunas-airport-scraps-requirement-to-remove-items-from-luggage-during-checks,Kaunas Airport scraps requirement to remove items from luggage during checks,/img/2024/02/13/1700948-450216-150x84.jpg
/en/news-in-english/19/2194817/iceland-s-play-airlines-to-launch-flights-from-vilnius-minister,Iceland’s Play Airlines to launch flights from Vilnius – minister,/img/2023/04/20/1494783-684834-150x84.jpg
/en/news-in-english/19/2194797/around-eur40m-could-be-gone-from-baltcap-fund-lawyer,Around €40m could be gone from BaltCap fund – lawyer,/img/2024/02/13/1700920-917620-150x84.jpg
/en/news-in-english/19/2194786/russia-may-double-troops-along-border-with-baltics-finland-estonian-intelligence,"Russia may double troops along border with Baltics, Finland – Estonian intelligence",/img/2022/02/22/1200771-419818-150x84.jpg
/en/news-in-english/19/2194720/pro-russian-hackers-attempted-to-infiltrate-lithuanian-military-system,Pro-Russian hackers attempted to infiltrate Lithuanian military system,/img/2020/02/21/606952-323941-150x84.jpg
/en/news-in-english/19/2194643/russia-puts-29-lithuanian-politicians-public-figures-on-wanted-list,"Russia puts 29 Lithuanian politicians, public figures on wanted list",/img/2021/06/16/991657-998248-150x84.jpg
/en/news-in-english/19/2194614/eu-citizens-can-register-to-vote-in-lithuania-s-ep-elections-until-april-10,EU citizens can register to vote in Lithuania’s EP elections until April 10,/img/2019/11/28/558661-552864-150x84.jpg
/en/news-in-english/19/2195665/mp-expense-reports-give-appearance-of-abuse-by-lithuanian-top-politicians,MP expense reports give ‘appearance’ of abuse by Lithuanian top politicians,
/en/news-in-english/19/2194573/more-lithuanian-towns-want-to-be-serviced-by-vilnius-riga-train,More Lithuanian towns want to be serviced by Vilnius–Riga train,
/en/news-in-english/19/2195979/lithuanian-government-to-turn-to-constitutional-court-to-invalidate-anti-lgbtq-law,Lithuanian government to turn to Constitutional Court to invalidate anti-LGBTQ law,/img/2020/07/11/683541-692888-393x221.jpg
/en/news-in-english/19/2195683/first-michelin-star-will-cost-lithuania-eur1-7m,First Michelin star will cost Lithuania €1.7m,/img/2023/08/04/1563793-494806-393x221.jpg
/en/news-in-english/19/2195646/lithuanian-mp-zemaitaitis-stripped-of-immunity-over-anti-semitic-posts,Lithuanian MP Žemaitaitis stripped of immunity over anti-Semitic posts,/img/2023/12/05/1654516-626387-393x221.jpg
/en/news-in-english/19/2195979/lithuanian-government-to-turn-to-constitutional-court-to-invalidate-anti-lgbtq-law,Lithuanian government to turn to Constitutional Court to invalidate anti-LGBTQ law,/img/2020/07/11/683541-692888-615x345.jpg
/en/news-in-english/19/2195665/mp-expense-reports-give-appearance-of-abuse-by-lithuanian-top-politicians,MP expense reports give ‘appearance’ of abuse by Lithuanian top politicians,/img/2023/12/12/1659670-60182-393x221.jpg
/en/news-in-english/19/2195646/lithuanian-mp-zemaitaitis-stripped-of-immunity-over-anti-semitic-posts,Lithuanian MP Žemaitaitis stripped of immunity over anti-Semitic posts,/img/2023/12/05/1654516-626387-393x221.jpg
/en/news-in-english/19/2195576/lithuania-protests-russia-putting-politicians-on-wanted-list,Lithuania protests Russia putting politicians on wanted list,/img/2022/06/20/1288233-86908-393x221.jpg
/en/news-in-english/19/2195029/belarusian-opposition-vows-to-correct-lithuania-border-error-in-new-passports,Belarusian opposition vows to correct Lithuania border error in new passports,/img/2022/08/10/1319972-889118-393x221.jpg
/en/news-in-english/19/2194643/russia-puts-29-lithuanian-politicians-public-figures-on-wanted-list,"Russia puts 29 Lithuanian politicians, public figures on wanted list",/img/2021/06/16/991657-998248-615x345.jpg
/en/news-in-english/19/2192021/attacking-poland-or-latvia-out-of-the-question-says-putin-in-scandalous-interview,"Attacking Poland or Latvia ‘out of the question’, says Putin in scandalous interview",/img/2024/02/09/1698680-787005-615x345.jpg
/en/news-in-english/19/2189938/belarusian-reps-in-lithuania-warn-against-building-new-iron-curtain,Belarusian reps in Lithuania warn against building new ‘iron curtain’,/img/2024/01/17/1682588-12834-615x345.jpg
/en/news-in-english/19/2189254/moscow-accuses-baltic-states-of-sabotage-in-russian-president-election,Moscow accuses Baltic states of ‘sabotage’ in Russian president election,/img/2019/08/29/499258-883106-615x345.jpg
/en/news-in-english/19/2195683/first-michelin-star-will-cost-lithuania-eur1-7m,First Michelin star will cost Lithuania €1.7m,/img/2023/08/04/1563793-494806-615x345.jpg
/en/news-in-english/19/2195052/does-vilnius-need-a-national-stadium,Does Vilnius need a national stadium?,/img/2022/08/29/1331261-944016-615x345.jpg
/en/news-in-english/19/2194573/more-lithuanian-towns-want-to-be-serviced-by-vilnius-riga-train,More Lithuanian towns want to be serviced by Vilnius–Riga train,/img/2024/01/08/1675583-642454-615x345.jpg
/en/news-in-english/19/2194938/kaunas-airport-scraps-requirement-to-remove-items-from-luggage-during-checks,Kaunas Airport scraps requirement to remove items from luggage during checks,/img/2024/02/13/1700948-450216-615x345.jpg
/en/news-in-english/19/2195443/lithuanian-seniors-to-try-out-speed-dating-on-valentine-s-day,Lithuanian seniors to try out speed dating on Valentine’s Day,/img/2021/05/13/967924-938185-615x345.jpg
/en/news-in-english/19/2192355/stained-glass-work-discovered-in-vilnius-strip-club-to-be-given-state-protection,Stained glass work discovered in Vilnius strip club to be given state protection,/img/2024/02/09/1699135-625814-615x345.jpg
/en/news-in-english/19/2191191/vilnius-restores-landmark-monument-of-the-grand-duchy-of-lithuania,Vilnius restores landmark monument of the Grand Duchy of Lithuania,/img/2024/02/09/1699341-492596-615x345.jpg
/en/news-in-english/19/2192957/last-two-eurovision-hopefuls-qualify-for-lithuania-s-national-finals,Last two Eurovision hopefuls qualify for Lithuania’s national finals,/img/2024/02/10/1699733-690820-615x345.jpg
/en/news-in-english/19/2194059/lithuanian-grocery-couriers-speak-of-exploitation-unrealistic-performance-goals-and-obstacles-to-unionisation,Lithuanian grocery couriers speak of exploitation: unrealistic performance goals and obstacles to unionisation,/img/2021/12/03/1148489-441797-615x345.jpg
/en/news-in-english/19/2191731/lrt-english-newsletter-the-plot-thickens,LRT English Newsletter: The plot thickens,/img/2024/02/08/1698555-693163-615x345.jpg
/en/news-in-english/19/2188836/defence-holocaust-memory-and-human-rights-interview-with-new-us-ambassador-to-lithuania,"Defence, Holocaust memory, and human rights – interview with new US ambassador to Lithuania",/img/2024/02/06/1697073-547562-615x345.jpg
/en/news-in-english/19/2187928/baltcap-scandal-how-could-one-man-steal-eur16m-or-twice-as-much-without-anyone-noticing,BaltCap scandal: how could one man steal €16m – or twice as much – without anyone noticing?,/img/2024/02/02/1694200-775425-615x345.jpg
