url,headline,img_path
/en/news-in-english/19/2178213/lithuania-hands-in-note-to-belarus-over-border-violation-by-three-armed-guards,Lithuania hands in note to Belarus over border violation by three armed guards,/img/2024/01/23/1686759-728541-150x84.png
/en/news-in-english/19/2178174/we-don-t-protest-unless-it-s-necessary-farmers-gather-in-vilnius-for-2-day-rally,‘We don’t protest unless it’s necessary’ – farmers gather in Vilnius for 2-day rally,/img/2024/01/23/1686710-299661-150x84.jpg
/en/news-in-english/19/2177992/kremlin-preparing-for-long-term-confrontation-with-the-west-lithuanian-intelligence-chief,‘Kremlin preparing for long-term confrontation with the West’ – Lithuanian intelligence chief,/img/2023/07/28/1560093-679004-150x84.jpg
/en/news-in-english/19/2177909/lithuania-s-state-defence-council-agrees-to-buy-german-leopard-tanks-adviser,Lithuania’s State Defence Council agrees to buy German Leopard tanks – adviser,/img/2023/12/27/1668459-956689-150x84.jpg
/en/news-in-english/19/2177867/lithuanian-labour-party-names-mp-mazuronis-as-presidential-candidate,Lithuanian Labour Party names MP Mazuronis as presidential candidate,/img/2023/10/24/1613614-570897-150x84.jpg
/en/news-in-english/19/2177825/few-lithuanian-schools-will-offer-russian-classes-in-10-years-minister,Few Lithuanian schools will offer Russian classes in 10 years – minister,/img/2022/09/07/1337589-624157-150x84.jpg
/en/news-in-english/19/2177775/estonia-s-ekspress-grupp-appeals-lithuanian-watchdog-s-decision-on-news-website-acquisition,Estonia’s Ekspress Grupp appeals Lithuanian watchdog’s decision on news website acquisition,/img/2023/12/22/1666780-177393-150x84.jpg
/en/news-in-english/19/2177633/lithuania-scraps-external-visa-services-in-lebanon-jordan-sri-lanka,"Lithuania scraps external visa services in Lebanon, Jordan, Sri Lanka",/img/2023/10/25/1614275-851714-150x84.jpg
/en/news-in-english/19/2177163/up-to-300-000-lithuanian-citizens-may-live-in-russian-disinformation-field-study,"Up to 300,000 Lithuanian citizens may live in Russian disinformation field – study",/img/2023/10/20/1611705-48879-150x84.jpg
/en/news-in-english/19/2177292/500-tractors-in-vilnius-lithuanian-farmers-gear-up-for-protest,500 tractors in Vilnius: Lithuanian farmers gear up for protest,/img/2024/01/23/1686535-33635-150x84.jpg
/en/news-in-english/19/2177144/centre-for-tackling-illegal-work-employer-abuse-to-be-set-up-in-vilnius,"Centre for tackling illegal work, employer abuse to be set up in Vilnius",/img/2020/10/15/741879-183563-150x84.jpg
/en/news-in-english/19/2177114/lithuanian-president-calls-state-defence-council-meeting-to-discuss-division-plans,Lithuanian president calls State Defence Council meeting to discuss division plans,/img/2021/01/13/808244-67735-150x84.jpg
/en/news-in-english/19/2176902/international-tactical-air-control-party-exercise-kicks-off-in-lithuania,International tactical air control party exercise kicks off in Lithuania,/img/2024/01/22/1686016-577415-150x84.jpg
/en/news-in-english/19/2176813/lithuania-poland-to-step-up-military-cooperation-hold-joint-military-exercises-in-suwalki-gap,"Lithuania, Poland to step up military cooperation, hold joint military exercises in Suwalki Gap",/img/2024/01/21/1685404-120725-150x84.jpg
/en/news-in-english/19/2176672/mp-zemaitaitis-accused-of-anti-semitism-to-run-for-lithuanian-president,"MP Žemaitaitis, accused of anti-Semitism, to run for Lithuanian president",/img/2023/06/15/1532918-873006-150x84.jpg
/en/news-in-english/19/2176633/baltics-agree-on-common-defence-line-on-russia-belarus-borders,"Baltics agree on common defence line on Russia, Belarus borders",/img/2021/03/16/843502-274625-150x84.jpg
/en/news-in-english/19/2178174/we-don-t-protest-unless-it-s-necessary-farmers-gather-in-vilnius-for-2-day-rally,‘We don’t protest unless it’s necessary’ – farmers gather in Vilnius for 2-day rally,
/en/news-in-english/19/2177909/lithuania-s-state-defence-council-agrees-to-buy-german-leopard-tanks-adviser,Lithuania’s State Defence Council agrees to buy German Leopard tanks – adviser,
/en/news-in-english/19/2178213/lithuania-hands-in-note-to-belarus-over-border-violation-by-three-armed-guards,Lithuania hands in note to Belarus over border violation by three armed guards,/img/2024/01/23/1686759-728541-393x221.png
/en/news-in-english/19/2177992/kremlin-preparing-for-long-term-confrontation-with-the-west-lithuanian-intelligence-chief,‘Kremlin preparing for long-term confrontation with the West’ – Lithuanian intelligence chief,/img/2023/07/28/1560093-679004-393x221.jpg
/en/news-in-english/19/2177867/lithuanian-labour-party-names-mp-mazuronis-as-presidential-candidate,Lithuanian Labour Party names MP Mazuronis as presidential candidate,/img/2023/10/24/1613614-570897-393x221.jpg
/en/news-in-english/19/2178213/lithuania-hands-in-note-to-belarus-over-border-violation-by-three-armed-guards,Lithuania hands in note to Belarus over border violation by three armed guards,/img/2024/01/23/1686759-728541-615x345.png
/en/news-in-english/19/2177992/kremlin-preparing-for-long-term-confrontation-with-the-west-lithuanian-intelligence-chief,‘Kremlin preparing for long-term confrontation with the West’ – Lithuanian intelligence chief,/img/2023/07/28/1560093-679004-393x221.jpg
/en/news-in-english/19/2177909/lithuania-s-state-defence-council-agrees-to-buy-german-leopard-tanks-adviser,Lithuania’s State Defence Council agrees to buy German Leopard tanks – adviser,/img/2023/12/27/1668459-956689-393x221.jpg
/en/news-in-english/19/2177867/lithuanian-labour-party-names-mp-mazuronis-as-presidential-candidate,Lithuanian Labour Party names MP Mazuronis as presidential candidate,/img/2023/10/24/1613614-570897-393x221.jpg
/en/news-in-english/19/2177633/lithuania-scraps-external-visa-services-in-lebanon-jordan-sri-lanka,"Lithuania scraps external visa services in Lebanon, Jordan, Sri Lanka",/img/2023/10/25/1614275-851714-393x221.jpg
/en/news-in-english/19/2176633/baltics-agree-on-common-defence-line-on-russia-belarus-borders,"Baltics agree on common defence line on Russia, Belarus borders",/img/2021/03/16/843502-274625-615x345.jpg
/en/news-in-english/19/2175244/lithuanian-citizen-killed-in-ukraine-while-fighting-on-russian-side-media,Lithuanian citizen killed in Ukraine while fighting on Russian side – media,/img/2023/01/13/1427248-309816-615x345.jpg
/en/news-in-english/19/2173860/russian-grain-transit-via-latvia-still-a-big-problem-lithuanian-minister,Russian grain transit via Latvia still ‘a big problem’ – Lithuanian minister,/img/2024/01/17/1682921-611979-615x345.jpg
/en/news-in-english/19/2171349/lithuania-still-undecided-whether-to-repatriate-military-age-ukrainians,Lithuania still undecided whether to repatriate military-age Ukrainians,/img/2023/11/29/1650611-629870-615x345.jpg
/en/news-in-english/19/2178174/we-don-t-protest-unless-it-s-necessary-farmers-gather-in-vilnius-for-2-day-rally,‘We don’t protest unless it’s necessary’ – farmers gather in Vilnius for 2-day rally,/img/2024/01/23/1686710-299661-615x345.jpg
/en/news-in-english/19/2177775/estonia-s-ekspress-grupp-appeals-lithuanian-watchdog-s-decision-on-news-website-acquisition,Estonia’s Ekspress Grupp appeals Lithuanian watchdog’s decision on news website acquisition,/img/2023/12/22/1666780-177393-615x345.jpg
/en/news-in-english/19/2177292/500-tractors-in-vilnius-lithuanian-farmers-gear-up-for-protest,500 tractors in Vilnius: Lithuanian farmers gear up for protest,/img/2024/01/23/1686535-33635-615x345.jpg
/en/news-in-english/19/2177144/centre-for-tackling-illegal-work-employer-abuse-to-be-set-up-in-vilnius,"Centre for tackling illegal work, employer abuse to be set up in Vilnius",/img/2020/10/15/741879-183563-615x345.jpg
/en/news-in-english/19/2177825/few-lithuanian-schools-will-offer-russian-classes-in-10-years-minister,Few Lithuanian schools will offer Russian classes in 10 years – minister,/img/2022/09/07/1337589-624157-615x345.jpg
/en/news-in-english/19/2177163/up-to-300-000-lithuanian-citizens-may-live-in-russian-disinformation-field-study,"Up to 300,000 Lithuanian citizens may live in Russian disinformation field – study",/img/2023/10/20/1611705-48879-615x345.jpg
/en/news-in-english/19/2173145/winter-travel-most-impressive-stones-in-lithuania,Winter travel: Most impressive stones in Lithuania,/img/2024/01/11/1678002-347221-615x345.jpg
/en/news-in-english/19/2176176/second-batch-of-lithuania-s-eurovision-hopefuls-present-their-songs,Second batch of Lithuania’s Eurovision hopefuls present their songs,/img/2024/01/20/1685322-275323-615x345.jpg
/en/news-in-english/19/2174634/we-lost-our-community-for-nothing-young-roma-laments-demolition-of-vilnius-tabor,‘We lost our community for nothing’ – young Roma laments demolition of Vilnius tabor,/img/2020/05/06/649509-749707-615x345.jpg
/en/news-in-english/19/2175603/how-ethnic-composition-of-vilnius-changed-over-time,How ethnic composition of Vilnius changed over time,/img/2021/10/28/1094460-816929-615x345.jpg
/en/news-in-english/19/2174930/lrt-english-newsletter-scandal-on-ice,LRT English Newsletter: Scandal on ice,/img/2024/01/13/1680317-817045-615x345.jpg
/en/news-in-english/19/2174015/we-re-perfectly-capable-of-defending-against-russian-aggression-nato-assistant-secretary-general,‘We’re perfectly capable of defending against Russian aggression’ – NATO assistant secretary general,/img/2023/11/21/1638188-175532-615x345.jpg
