url,headline,img_path
/en/news-in-english/19/2932112/lithuanian-president-too-early-to-draw-conclusions-on-us-troop-movements,Lithuanian president: too early to draw conclusions on US troop movements,/img/2026/05/07/2384075-17559-150x84.jpg
/en/news-in-english/19/2932087/lithuania-would-only-send-troops-to-strait-of-hormuz-after-us-iran-peace-deal-president,Lithuania would only send troops to Strait of Hormuz after US-Iran peace deal – president,/img/2026/05/12/2387847-343558-150x84.jpg
/en/news-in-english/19/2932077/defence-minister-presses-air-force-on-radar-gaps-after-drone-crash-goes-undetected,Defence minister presses Air Force on radar gaps after drone crash goes undetected,/img/2026/05/07/2383641-490871-150x84.jpg
/en/news-in-english/19/2932051/authorities-continue-search-for-drone-debris-in-lithuania,Authorities continue search for drone debris in Lithuania,/img/2026/05/17/2392307-623807-150x84.jpg
/en/news-in-english/19/2926379/reputation-of-lithuanian-railways-wavers-following-two-incidents,Reputation of Lithuanian Railways wavers following two incidents,/img/2026/05/03/2380675-299805-150x84.jpg
/en/news-in-english/19/2931146/drone-crashed-in-lithuania-believed-to-be-ukrainian-military-aircraft,"Drone crashed in Lithuania, believed to be Ukrainian military aircraft",/img/2026/03/26/2354051-764111-150x84.jpg
/en/news-in-english/19/2931013/lithuania-s-lion-ceccah-finishes-eurovision-performance-in-22nd-place,Lithuania’s Lion Ceccah finishes Eurovision performance in 22nd place,/img/2026/05/17/2392028-144396-150x84.jpg
/en/news-in-english/19/2925378/kombucha-s-eastern-european-cousin-lithuanian-entrepreneur-bringing-gira-to-britain,‘Kombucha’s Eastern European cousin’: Lithuanian entrepreneur bringing Gira to Britain,/img/2026/05/05/2382210-74267-150x84.jpg
/en/news-in-english/19/2927078/from-factories-to-theatres-lithuanian-chicago-opera-marks-70-year-anniversary,From factories to theatres: Lithuanian Chicago Opera marks 70-year anniversary,/img/2022/05/06/1254610-246410-150x84.png
/en/news-in-english/19/2929110/ukrainian-drones-in-baltics-present-a-paradox-interview-with-stubb-in-vilnius,Ukrainian drones in Baltics present a paradox – interview with Stubb in Vilnius,/img/2026/05/14/2390118-742256-150x84.jpg
/en/news-in-english/19/2929375/north-macedonia-to-open-embassy-in-vilnius,North Macedonia to open embassy in Vilnius,/img/2026/05/01/2380009-584006-150x84.jpg
/en/news-in-english/19/2929373/vilnius-tel-aviv-direct-flights-resume-after-suspension,Vilnius-Tel Aviv direct flights resume after suspension,/img/2025/10/05/2203540-949738-150x84.jpg
/en/news-in-english/19/2929368/klaipeda-port-to-invest-over-eur70m-in-cruise-terminal-port-building,"Klaipėda Port to invest over €70m in cruise terminal, port building",/img/2020/02/19/605893-727848-150x84.jpg
/en/news-in-english/19/2929344/lithuanian-jewish-community-opposes-memorial-plans-at-former-vilnius-sports-palace,Lithuanian Jewish community opposes memorial plans at former Vilnius Sports Palace,/img/2025/07/25/2138785-131046-150x84.jpg
/en/news-in-english/19/2929341/lithuania-aims-to-adopt-finland-s-total-defence-practices,Lithuania aims to adopt Finland’s total defence practices,/img/2025/02/25/2003586-76200-150x84.jpg
/en/news-in-english/19/2929272/prosecutors-probe-law-and-democracy-centre-previously-led-by-lithuanian-mep,Prosecutors probe Law and Democracy Centre previously led by Lithuanian MEP,/img/2026/05/12/2387353-198603-150x84.jpg
/en/news-in-english/19/2926379/reputation-of-lithuanian-railways-wavers-following-two-incidents,Reputation of Lithuanian Railways wavers following two incidents,
/en/news-in-english/19/2932112/lithuanian-president-too-early-to-draw-conclusions-on-us-troop-movements,Lithuanian president: too early to draw conclusions on US troop movements,
/en/news-in-english/19/2932087/lithuania-would-only-send-troops-to-strait-of-hormuz-after-us-iran-peace-deal-president,Lithuania would only send troops to Strait of Hormuz after US-Iran peace deal – president,/img/2026/05/12/2387847-343558-393x221.jpg
/en/news-in-english/19/2932077/defence-minister-presses-air-force-on-radar-gaps-after-drone-crash-goes-undetected,Defence minister presses Air Force on radar gaps after drone crash goes undetected,/img/2026/05/07/2383641-490871-393x221.jpg
/en/news-in-english/19/2932051/authorities-continue-search-for-drone-debris-in-lithuania,Authorities continue search for drone debris in Lithuania,/img/2026/05/17/2392307-623807-393x221.jpg
/en/news-in-english/19/2932087/lithuania-would-only-send-troops-to-strait-of-hormuz-after-us-iran-peace-deal-president,Lithuania would only send troops to Strait of Hormuz after US-Iran peace deal – president,/img/2026/05/12/2387847-343558-615x345.jpg
/en/news-in-english/19/2932077/defence-minister-presses-air-force-on-radar-gaps-after-drone-crash-goes-undetected,Defence minister presses Air Force on radar gaps after drone crash goes undetected,/img/2026/05/07/2383641-490871-393x221.jpg
/en/news-in-english/19/2932051/authorities-continue-search-for-drone-debris-in-lithuania,Authorities continue search for drone debris in Lithuania,/img/2026/05/17/2392307-623807-393x221.jpg
/en/news-in-english/19/2926379/reputation-of-lithuanian-railways-wavers-following-two-incidents,Reputation of Lithuanian Railways wavers following two incidents,/img/2026/05/03/2380675-299805-393x221.jpg
/en/news-in-english/19/2931146/drone-crashed-in-lithuania-believed-to-be-ukrainian-military-aircraft,"Drone crashed in Lithuania, believed to be Ukrainian military aircraft",/img/2026/03/26/2354051-764111-393x221.jpg
/en/news-in-english/19/2932112/lithuanian-president-too-early-to-draw-conclusions-on-us-troop-movements,Lithuanian president: too early to draw conclusions on US troop movements,/img/2026/05/07/2384075-17559-615x345.jpg
/en/news-in-english/19/2925358/lithuanian-leaders-clash-over-possible-dialogue-with-belarus,Lithuanian leaders clash over possible dialogue with Belarus,/img/2026/05/01/2379729-246331-615x345.jpg
/en/news-in-english/19/2926062/council-of-europe-opening-belarus-information-point-in-vilnius,Council of Europe opening Belarus information point in Vilnius,/img/2020/04/27/644429-226063-615x345.jpg
/en/news-in-english/19/2925249/ukraine-ready-for-serious-talks-with-russia-budanov-in-vilnius,Ukraine ready for serious talks with Russia – Budanov in Vilnius,/img/2026/02/27/2328118-90915-615x345.jpg
/en/news-in-english/19/2929368/klaipeda-port-to-invest-over-eur70m-in-cruise-terminal-port-building,"Klaipėda Port to invest over €70m in cruise terminal, port building",/img/2020/02/19/605893-727848-615x345.jpg
/en/news-in-english/19/2928220/invl-raises-eur27-3m-for-rudninkai-military-campus-to-house-german-troops,INVL raises €27.3m for Rūdninkai military campus to house German troops,/img/2025/12/18/2269090-379941-615x345.jpg
/en/news-in-english/19/2927171/rheinmetall-ammo-factory-construction-in-lithuania-slightly-behind-schedule,Rheinmetall ammo factory construction in Lithuania ‘slightly behind’ schedule,/img/2025/11/04/2230800-208152-615x345.jpg
/en/news-in-english/19/2927123/airbaltic-cancels-summer-flights-between-vilnius-and-krakow,airBaltic cancels summer flights between Vilnius and Krakow,/img/2025/01/02/1956612-953484-615x345.jpg
/en/news-in-english/19/2927078/from-factories-to-theatres-lithuanian-chicago-opera-marks-70-year-anniversary,From factories to theatres: Lithuanian Chicago Opera marks 70-year anniversary,/img/2022/05/06/1254610-246410-615x345.png
/en/news-in-english/19/2926156/lithuania-s-health-system-is-locking-out-its-own-doctors,Lithuania's health system is locking out its own doctors,/img/2020/01/13/583594-928351-615x345.jpg
/en/news-in-english/19/2927277/abortion-ban-to-free-meals-lithuanian-parties-diverge-on-how-to-boost-birth-rates,Abortion ban to free meals – Lithuanian parties diverge on how to boost birth rates,/img/2021/04/29/958047-280659-615x345.jpg
/en/news-in-english/19/2927061/lithuania-advances-to-eurovision-final,Lithuania advances to Eurovision final,/img/2026/05/12/2388204-266176-615x345.jpg
/en/news-in-english/19/2925378/kombucha-s-eastern-european-cousin-lithuanian-entrepreneur-bringing-gira-to-britain,‘Kombucha’s Eastern European cousin’: Lithuanian entrepreneur bringing Gira to Britain,/img/2026/05/05/2382210-74267-615x345.jpg
/en/news-in-english/19/2929110/ukrainian-drones-in-baltics-present-a-paradox-interview-with-stubb-in-vilnius,Ukrainian drones in Baltics present a paradox – interview with Stubb in Vilnius,/img/2026/05/14/2390118-742256-615x345.jpg
/en/news-in-english/19/2929001/lrt-english-newsletter-another-week-another-scandal-for-nemunas-dawn,"LRT English Newsletter: Another week, another scandal for Nemunas Dawn",/img/2026/05/14/2389497-95550-615x345.jpg
/en/news-in-english/19/2926276/from-zero-points-to-the-yellow-wave-lithuania-s-eurovision-journey-in-27-acts,From zero points to the ‘Yellow Wave’: Lithuania’s Eurovision journey in 27 acts,/img/2026/04/17/2369916-881063-615x345.jpg
