url,headline,img_path
/en/news-in-english/19/2935098/lithuania-says-hotline-with-belarus-remains-operational-despite-tensions,Lithuania says hotline with Belarus remains operational despite tensions,/img/2025/06/01/2087731-733746-150x84.jpg
/en/news-in-english/19/2935070/lithuanian-military-resumes-drone-search-after-overnight-pause,Lithuanian military resumes drone search after overnight pause,/img/2026/05/20/2394790-329304-150x84.jpg
/en/news-in-english/19/2935063/lithuanian-transport-minister-to-review-air-alert-response-with-state-firms,Lithuanian transport minister to review air alert response with state firms,/img/2026/02/12/2313661-25943-150x84.jpg
/en/news-in-english/19/2934300/understanding-air-alert-warnings-in-lithuania-explainer,Understanding air alert warnings in Lithuania 芒聙聯 explainer,/img/2026/05/20/2394522-571834-150x84.jpg
/en/news-in-english/19/2934264/state-security-chief-says-lithuania-security-situation-increasingly-tense,State security chief says Lithuania security situation increasingly tense,/img/2021/02/24/831096-630472-150x84.jpg
/en/news-in-english/19/2934114/finnish-defence-firm-patria-seeks-to-bring-lithuania-into-armoured-vehicle-programme,Finnish defence firm Patria seeks to bring Lithuania into armoured vehicle programme,/img/2019/08/28/498167-36162-150x84.jpg
/en/news-in-english/19/2934073/air-alert-in-vilnius-lifted-following-drone-sighting-in-border-regions,Air alert in Vilnius lifted following drone sighting in border regions,/img/2022/06/21/1288652-566388-150x84.jpg
/en/news-in-english/19/2926292/the-hardest-thing-is-the-language-indian-citizens-face-integration-hurdles-in-lithuania,芒聙聵The hardest thing is the language芒聙聶: Indian citizens face integration hurdles in Lithuania,/img/2026/05/04/2381478-425194-150x84.jpg
/en/news-in-english/19/2933328/lithuania-backs-armenia-s-eu-bid-foreign-minister-says-in-yerevan,"Lithuania backs Armenia芒聙聶s EU bid, foreign minister says in Yerevan",/img/2020/02/13/601783-737720-150x84.jpg
/en/news-in-english/19/2933248/nato-fighter-jet-stationed-in-lithuania-shoots-down-drone-in-estonia,NATO fighter jet stationed in Lithuania shoots down drone in Estonia,/img/2025/10/20/2217131-970838-150x84.jpg
/en/news-in-english/19/2933201/lithuanian-officials-back-talks-on-allowing-nuclear-weapons-on-country-s-territory,Lithuanian officials back talks on allowing nuclear weapons on country芒聙聶s territory,/img/2023/03/06/1463033-523584-150x84.jpg
/en/news-in-english/19/2933148/lithuania-ranks-among-worst-in-europe-on-transgender-rights-index-shows,"Lithuania ranks among worst in Europe on transgender rights, index shows",/img/2025/04/10/2041668-433742-150x84.jpg
/en/news-in-english/19/2933058/lithuania-warns-of-possible-provocations-after-russian-drone-allegations,Lithuania warns of possible provocations after Russian drone allegations,/img/2024/04/04/1743672-438055-150x84.jpg
/en/news-in-english/19/2925306/despite-favourable-court-rulings-same-sex-couples-face-new-roadblocks-in-lithuania,"Despite favourable court rulings, same-sex couples face new roadblocks in Lithuania",/img/2025/09/11/2179001-231934-150x84.jpg
/en/news-in-english/19/2932362/lithuania-decides-against-withdrawing-from-venice-biennale-despite-russia-controversy,Lithuania decides against withdrawing from Venice Biennale despite Russia controversy,/img/2026/05/18/2392560-192452-150x84.jpg
/en/news-in-english/19/2932051/drone-that-crashed-in-lithuania-neutralised-in-a-controlled-explosion,Drone that crashed in Lithuania neutralised in a controlled explosion,/img/2026/05/18/2392737-277319-150x84.jpg
/en/news-in-english/19/2935063/lithuanian-transport-minister-to-review-air-alert-response-with-state-firms,Lithuanian transport minister to review air alert response with state firms,
/en/news-in-english/19/2935098/lithuania-says-hotline-with-belarus-remains-operational-despite-tensions,Lithuania says hotline with Belarus remains operational despite tensions,
/en/news-in-english/19/2935070/lithuanian-military-resumes-drone-search-after-overnight-pause,Lithuanian military resumes drone search after overnight pause,/img/2026/05/20/2394790-329304-393x221.jpg
/en/news-in-english/19/2934300/understanding-air-alert-warnings-in-lithuania-explainer,Understanding air alert warnings in Lithuania 芒聙聯 explainer,/img/2026/05/20/2394522-571834-393x221.jpg
/en/news-in-english/19/2934264/state-security-chief-says-lithuania-security-situation-increasingly-tense,State security chief says Lithuania security situation increasingly tense,/img/2021/02/24/831096-630472-393x221.jpg
/en/news-in-english/19/2935098/lithuania-says-hotline-with-belarus-remains-operational-despite-tensions,Lithuania says hotline with Belarus remains operational despite tensions,/img/2025/06/01/2087731-733746-615x345.jpg
/en/news-in-english/19/2935070/lithuanian-military-resumes-drone-search-after-overnight-pause,Lithuanian military resumes drone search after overnight pause,/img/2026/05/20/2394790-329304-393x221.jpg
/en/news-in-english/19/2935063/lithuanian-transport-minister-to-review-air-alert-response-with-state-firms,Lithuanian transport minister to review air alert response with state firms,/img/2026/02/12/2313661-25943-393x221.jpg
/en/news-in-english/19/2934300/understanding-air-alert-warnings-in-lithuania-explainer,Understanding air alert warnings in Lithuania 芒聙聯 explainer,/img/2026/05/20/2394522-571834-393x221.jpg
/en/news-in-english/19/2934264/state-security-chief-says-lithuania-security-situation-increasingly-tense,State security chief says Lithuania security situation increasingly tense,/img/2021/02/24/831096-630472-393x221.jpg
/en/news-in-english/19/2933328/lithuania-backs-armenia-s-eu-bid-foreign-minister-says-in-yerevan,"Lithuania backs Armenia芒聙聶s EU bid, foreign minister says in Yerevan",/img/2020/02/13/601783-737720-615x345.jpg
/en/news-in-english/19/2932112/lithuanian-president-too-early-to-draw-conclusions-on-us-troop-movements,Lithuanian president: too early to draw conclusions on US troop movements,/img/2026/05/07/2384075-17559-615x345.jpg
/en/news-in-english/19/2927342/thirty-roubles-and-panic-in-brussels-the-story-of-a-channel-that-never-existed,Thirty roubles and panic in Brussels: the story of a channel that never existed,/img/2026/05/13/2389020-15355-615x345.png
/en/news-in-english/19/2925358/lithuanian-leaders-clash-over-possible-dialogue-with-belarus,Lithuanian leaders clash over possible dialogue with Belarus,/img/2026/05/01/2379729-246331-615x345.jpg
/en/news-in-english/19/2932283/brussels-approves-eur153m-in-additional-funding-for-lithuania,Brussels approves 芒聜卢153m in additional funding for Lithuania,/img/2026/03/28/2355899-379958-615x345.jpg
/en/news-in-english/19/2932132/lithuania-risks-breaching-eu-fiscal-rules-as-defence-spending-mounts,Lithuania risks breaching EU fiscal rules as defence spending mounts,/img/2022/09/22/1348436-818889-615x345.jpg
/en/news-in-english/19/2929368/klaipeda-port-to-invest-over-eur70m-in-cruise-terminal-port-building,"Klaip脛聴da Port to invest over 芒聜卢70m in cruise terminal, port building",/img/2020/02/19/605893-727848-615x345.jpg
/en/news-in-english/19/2928220/invl-raises-eur27-3m-for-rudninkai-military-campus-to-house-german-troops,INVL raises 芒聜卢27.3m for R脜芦dninkai military campus to house German troops,/img/2025/12/18/2269090-379941-615x345.jpg
/en/news-in-english/19/2926292/the-hardest-thing-is-the-language-indian-citizens-face-integration-hurdles-in-lithuania,芒聙聵The hardest thing is the language芒聙聶: Indian citizens face integration hurdles in Lithuania,/img/2026/05/04/2381478-425194-615x345.jpg
/en/news-in-english/19/2933148/lithuania-ranks-among-worst-in-europe-on-transgender-rights-index-shows,"Lithuania ranks among worst in Europe on transgender rights, index shows",/img/2025/04/10/2041668-433742-615x345.jpg
/en/news-in-english/19/2925306/despite-favourable-court-rulings-same-sex-couples-face-new-roadblocks-in-lithuania,"Despite favourable court rulings, same-sex couples face new roadblocks in Lithuania",/img/2025/09/11/2179001-231934-615x345.jpg
/en/news-in-english/19/2927078/from-factories-to-theatres-lithuanian-chicago-opera-marks-70-year-anniversary,From factories to theatres: Lithuanian Chicago Opera marks 70-year anniversary,/img/2022/05/06/1254610-246410-615x345.png
/en/news-in-english/19/2925378/kombucha-s-eastern-european-cousin-lithuanian-entrepreneur-bringing-gira-to-britain,芒聙聵Kombucha芒聙聶s Eastern European cousin芒聙聶: Lithuanian entrepreneur bringing Gira to Britain,/img/2026/05/05/2382210-74267-615x345.jpg
/en/news-in-english/19/2929110/ukrainian-drones-in-baltics-present-a-paradox-interview-with-stubb-in-vilnius,Ukrainian drones in Baltics present a paradox 芒聙聯 interview with Stubb in Vilnius,/img/2026/05/14/2390118-742256-615x345.jpg
/en/news-in-english/19/2929001/lrt-english-newsletter-another-week-another-scandal-for-nemunas-dawn,"LRT English Newsletter: Another week, another scandal for Nemunas Dawn",/img/2026/05/14/2389497-95550-615x345.jpg
/en/news-in-english/19/2926276/from-zero-points-to-the-yellow-wave-lithuania-s-eurovision-journey-in-27-acts,From zero points to the 芒聙聵Yellow Wave芒聙聶: Lithuania芒聙聶s Eurovision journey in 27 acts,/img/2026/04/17/2369916-881063-615x345.jpg
